{
  "numero": "CO-2026-01873",
  "client": "c-0229",
  "reference_client": null,
  "cree_le": "2026-06-25T09:10:00+02:00",
  "cree_par": "benoit.faure",
  "mode": "standard",
  "livraison": {
    "code": "L1",
    "adresse": "63 rue des Forges, 36999 Vendrigny (FICTIF)"
  },
  "lignes": [
    {
      "reference": "ELE-10408",
      "libelle": "Borne de connexion à levier 3 conducteurs, boîte de 50",
      "quantite": 2,
      "prix_tarif_ht_euros": 28.5,
      "remise_pourcent": 4.0,
      "prix_net_ht_euros": 27.36,
      "prix_derogatoire": false,
      "taux_tva": 20,
      "montant_ht_euros": 54.72
    }
  ],
  "port_ht_euros": 15.0,
  "total_ht_euros": 69.72,
  "total_tva_euros": 13.94,
  "total_ttc_euros": 83.66,
  "statut": "facturee",
  "motif_attente": null,
  "reliquat_de": null,
  "livraisons": [
    "BL-2026-01722"
  ],
  "facture": "FC-2026-1209",
  "historique": [
    {
      "date": "2026-06-25T09:10:00+02:00",
      "par": "benoit.faure",
      "action": "creee",
      "detail": ""
    },
    {
      "date": "2026-06-25T09:12:00+02:00",
      "par": "benoit.faure",
      "action": "validee",
      "detail": ""
    },
    {
      "date": "2026-06-26T07:30:00+02:00",
      "par": "gilles.poirier",
      "action": "expediee",
      "detail": "BL-2026-01722"
    },
    {
      "date": "2026-06-26T11:00:00+02:00",
      "par": "gilles.poirier",
      "action": "livree",
      "detail": "BL-2026-01722"
    },
    {
      "date": "2026-06-30T18:00:00+02:00",
      "par": "isabelle.royer",
      "action": "facturee",
      "detail": "FC-2026-1209"
    }
  ]
}
