{
  "numero": "CO-2026-01884",
  "client": "c-0173",
  "reference_client": null,
  "cree_le": "2026-06-25T09:10:00+02:00",
  "cree_par": "oceane.collin",
  "mode": "express",
  "livraison": {
    "code": "L1",
    "adresse": "126 rue de l'Église, 36999 Fontclavier (FICTIF)"
  },
  "lignes": [
    {
      "reference": "VIS-12923",
      "libelle": "Vis à bois tête fraisée 5x45, zinguée, boîte de 200",
      "quantite": 4,
      "prix_tarif_ht_euros": 9.5,
      "remise_pourcent": 0.0,
      "prix_net_ht_euros": 9.5,
      "prix_derogatoire": false,
      "taux_tva": 20,
      "montant_ht_euros": 38.0
    }
  ],
  "port_ht_euros": 25.0,
  "total_ht_euros": 63.0,
  "total_tva_euros": 12.6,
  "total_ttc_euros": 75.6,
  "statut": "facturee",
  "motif_attente": null,
  "reliquat_de": null,
  "livraisons": [
    "BL-2026-01733"
  ],
  "facture": "FC-2026-1157",
  "historique": [
    {
      "date": "2026-06-25T09:10:00+02:00",
      "par": "oceane.collin",
      "action": "creee",
      "detail": ""
    },
    {
      "date": "2026-06-25T09:12:00+02:00",
      "par": "oceane.collin",
      "action": "validee",
      "detail": ""
    },
    {
      "date": "2026-06-25T16:00:00+02:00",
      "par": "gilles.poirier",
      "action": "expediee",
      "detail": "BL-2026-01733"
    },
    {
      "date": "2026-06-26T11:00:00+02:00",
      "par": "gilles.poirier",
      "action": "livree",
      "detail": "BL-2026-01733"
    },
    {
      "date": "2026-06-30T18:00:00+02:00",
      "par": "isabelle.royer",
      "action": "facturee",
      "detail": "FC-2026-1157"
    }
  ]
}
