{
  "numero": "CO-2026-01904",
  "client": "c-0207",
  "reference_client": null,
  "cree_le": "2026-06-26T09:10:00+02:00",
  "cree_par": "oceane.collin",
  "mode": "standard",
  "livraison": {
    "code": "L1",
    "adresse": "40 rue des Peupliers, 36999 Mérolles-en-Brenne (FICTIF)"
  },
  "lignes": [
    {
      "reference": "CON-11486",
      "libelle": "Mousse polyuréthane coupe-feu, 750 ml",
      "quantite": 10,
      "prix_tarif_ht_euros": 8.0,
      "remise_pourcent": 5.92,
      "prix_net_ht_euros": 7.53,
      "prix_derogatoire": false,
      "taux_tva": 20,
      "montant_ht_euros": 75.3
    },
    {
      "reference": "FIX-11894",
      "libelle": "Tige filetée M20, longueur 1 m, zinguée",
      "quantite": 10,
      "prix_tarif_ht_euros": 6.35,
      "remise_pourcent": 5.92,
      "prix_net_ht_euros": 5.97,
      "prix_derogatoire": false,
      "taux_tva": 20,
      "montant_ht_euros": 59.7
    },
    {
      "reference": "PLB-10147",
      "libelle": "Bonde à grille 90 mm",
      "quantite": 12,
      "prix_tarif_ht_euros": 12.4,
      "remise_pourcent": 4.0,
      "prix_net_ht_euros": 11.9,
      "prix_derogatoire": false,
      "taux_tva": 20,
      "montant_ht_euros": 142.8
    },
    {
      "reference": "PLB-13274",
      "libelle": "Tube multicouche 26 mm, couronne de 25 m",
      "quantite": 3,
      "prix_tarif_ht_euros": 92.25,
      "remise_pourcent": 4.0,
      "prix_net_ht_euros": 88.56,
      "prix_derogatoire": false,
      "taux_tva": 20,
      "montant_ht_euros": 265.68
    },
    {
      "reference": "PRO-11518",
      "libelle": "Pantalon de travail haute visibilité orange, taille 46",
      "quantite": 1,
      "prix_tarif_ht_euros": 43.2,
      "remise_pourcent": 4.0,
      "prix_net_ht_euros": 41.47,
      "prix_derogatoire": false,
      "taux_tva": 20,
      "montant_ht_euros": 41.47
    }
  ],
  "port_ht_euros": 0.0,
  "total_ht_euros": 584.95,
  "total_tva_euros": 116.99,
  "total_ttc_euros": 701.94,
  "statut": "facturee",
  "motif_attente": null,
  "reliquat_de": null,
  "livraisons": [
    "BL-2026-01753"
  ],
  "facture": "FC-2026-1187",
  "historique": [
    {
      "date": "2026-06-26T09:10:00+02:00",
      "par": "oceane.collin",
      "action": "creee",
      "detail": ""
    },
    {
      "date": "2026-06-26T09:12:00+02:00",
      "par": "oceane.collin",
      "action": "validee",
      "detail": ""
    },
    {
      "date": "2026-06-29T07:30:00+02:00",
      "par": "gilles.poirier",
      "action": "expediee",
      "detail": "BL-2026-01753"
    },
    {
      "date": "2026-06-29T11:00:00+02:00",
      "par": "gilles.poirier",
      "action": "livree",
      "detail": "BL-2026-01753"
    },
    {
      "date": "2026-06-30T18:00:00+02:00",
      "par": "isabelle.royer",
      "action": "facturee",
      "detail": "FC-2026-1187"
    }
  ]
}
