{
  "numero": "CO-2026-02079",
  "client": "c-0026",
  "reference_client": null,
  "cree_le": "2026-07-28T10:00:00+02:00",
  "cree_par": "manon.rey",
  "mode": "standard",
  "livraison": {
    "code": "L1",
    "adresse": "136 place du Marché, 36999 Vaumoreau-sur-Indre (FICTIF)"
  },
  "lignes": [
    {
      "reference": "OUT-12645",
      "libelle": "Tournevis Phillips n° 4",
      "quantite": 12,
      "prix_tarif_ht_euros": 11.0,
      "remise_pourcent": 8.0,
      "prix_net_ht_euros": 10.12,
      "prix_derogatoire": false,
      "taux_tva": 20,
      "montant_ht_euros": 121.44
    },
    {
      "reference": "PLB-12401",
      "libelle": "Robinet d'arrêt de machine à laver 12x17",
      "quantite": 10,
      "prix_tarif_ht_euros": 12.55,
      "remise_pourcent": 8.0,
      "prix_net_ht_euros": 11.55,
      "prix_derogatoire": false,
      "taux_tva": 20,
      "montant_ht_euros": 115.5
    }
  ],
  "port_ht_euros": 15.0,
  "total_ht_euros": 251.94,
  "total_tva_euros": 50.39,
  "total_ttc_euros": 302.33,
  "statut": "facturee",
  "motif_attente": null,
  "reliquat_de": null,
  "livraisons": [
    "BL-2026-01899"
  ],
  "facture": "FC-2026-1469",
  "historique": [
    {
      "date": "2026-07-28T10:00:00+02:00",
      "par": "manon.rey",
      "action": "creee",
      "detail": "commande du client"
    },
    {
      "date": "2026-07-28T10:05:00+02:00",
      "par": "manon.rey",
      "action": "validee",
      "detail": "stock réservé"
    },
    {
      "date": "2026-07-29T16:00:00+02:00",
      "par": "gilles.poirier",
      "action": "expediee",
      "detail": "BL-2026-01899"
    },
    {
      "date": "2026-07-30T11:00:00+02:00",
      "par": "gilles.poirier",
      "action": "livree",
      "detail": "BL-2026-01899"
    },
    {
      "date": "2026-07-31T18:00:00+02:00",
      "par": "isabelle.royer",
      "action": "facturee",
      "detail": "FC-2026-1469"
    }
  ]
}
